post_id,title,body,created_utc,score,num_comments,url,bucket,post_type
1iswotc,"now that enough time has passed after the finale,id like to share my thoughts. share yours as well!","i watched the first season of Cobra Kai,after years of hearing about its development. i was skeptical at first,as many others were,it just sounded like such a goofy idea. nope,i fell in love from the first episode. what a concept,what a story to tell! 
i got most of my family and friends into this show. starting with S3, i would gather them and we would have watch parties. it was like our superbowl. so when the finale came,i knew i would be an emotional wreck,it was gonna be the end of an era. to sum up how i feel about the finale in short words: its the perfect, imperfect ending to a show that didnt even have to exist. it gave enough to be classified as an ending,but it definitely left out a lot of things that made it imperfect. 
here are the things i wish the ending contained:

•kreese and Silver's deaths being acknowledged 

•kreese and daniel having one last conversation,possible apology and acceptance/forgiveness from Daniel

•we should have gotten a cameo from Neil Patrick Harris aka Barney from HIMYM,since that episode featuring Ralph and Billy Zabka played a huge part in getting the Cobra Kai show conceived. Same goes for the band No More Kings,as they made a song and music video: Sweep The Leg Johnny!. which also heavily influenced a resurgence of Karate Kid. That Jessie from saved by the bell cameo was a waste of opportunity and 
screen time,she served no purpose whatsoever.

•Would have been a nicer story/ending of the S.T. tournament,if it was Robby beating Axel,but then has to fight Miguel for the final battle,bringing everything full circle for the boys. with Miguel winning, but Robby getting his modeling offer with tory because of his fight with Axel. i absolutely HATE what they did to Robby. he never won a single tournament in the show. they wanted us to understand his frustration and reasoning of entering the S.T. - always getting 2nd place. then his last fight he gets injured and now hes like ""winning don't matter to me anymore"". like bro,what? it took a broken knee for you to feel that way?

•a scene of Robby and Kenny fully reconciling after the tournament since they didnt have much time to do so in Barcelona. Also wouldve been nice to see Kenny's brother one more time. he was an important character for Robby,he toughened him up in Juvie,and he also wasnt such a bad guy and gave Robby a lot of respect in the end. they focused on Kenny for the majority of S6 Part 1 with no resolution,and then he just gets sidelined the rest of the show.

•wish they gave stingray actual character development. from S2 to the finale,he is this 30yr old loser who hangs out with high school teens because he cant let go of his youth. im glad they didnt make him a creep,he was like a big cousin/uncle to the kids and it was cute at times because you know deep down hes a good guy,his actions are just weird lol. But it wouldve been dope to see him mature into a loveable but serious Karate sensei,who learns that its okay to have fun but we must be serious when appropriate. he expressed his dire love for karate,but it didnt translate the best imo. him being banned from the high school couldve taught him that he needs to be more of a guardian like figure to the kids instead of trying to be one of the kids. 

•i kinda feel the miyagi necklace reveal with mama Larusso was such an obvious cop out. i guess during an interview with the creators,it was revealed the miyagi mystery arc was in fact a plot device to introduce Julie/Hilary Swank into the show,and she wouldve been tied to the mystery with the answers daniel was seeking. she declined the offer to join the show,so they had to write a different version of the story. and it shows Big time.

At the end of the day,i LOVE this show,and i loved the ending despite its flaws. I can't wait for Karate Kid:Legends!",1739938398.0,4,13,https://www.reddit.com/r/cobrakai/comments/1iswotc/now_that_enough_time_has_passed_after_the/,immediate,general_reaction
1irvtzc,What do you guys think of the final 5 episodes of the series?,"I finished the show last night, I love the final part, what about the rest of you?",1739828726.0,18,40,https://www.reddit.com/r/cobrakai/comments/1irvtzc/what_do_you_guys_think_of_the_final_5_episodes_of/,immediate,general_reaction
1j0louk,Anyone else not like how they split the dojos in s6 ending,"At the end of season 6, it showed how Johnny retakes cobra Kai in reseda blvd, and teaches his cobra Kai in a better way using the motto (but changed the meaning) to make the kids stronger, and then showing how they will also learn Miyagi-Do. Anyone else prefer to have them learn both styles rather than have both dojos competing in the future all valleys. When Daniel and Johnny talk about Devon and Anthony competitions in the opposite dojo, I feel it ruins the purpose since I think it should all be under cobra Kai as they won the Sekai terai. Anyone else agree?",1740785837.0,4,22,https://www.reddit.com/r/cobrakai/comments/1j0louk/anyone_else_not_like_how_they_split_the_dojos_in/,immediate,scene_discussion
1iwgjak,Any other middle-aged adults cry during this season?,"Just finished season 6 and I must say. There were several times throughout the series where I felt the show “jumped the shark” but in the end, for what the series is, the creators did a pretty good job wrapping this up. 

Johnny getting that emotional release with Kreese and the flashbacks. Really resonated with me. Being so close to 40 myself, seeing how the show dealt with trauma that the adults were dealing with from being kids in the 80s was a great touch. And seeing Johnny redeem himself and become a family man. Just really made me realize, I’m not a kid watching Saturday cartoons anymore.  

Series had a few flaws but overall I enjoyed the journey and the few tears I shed. ",1740334629.0,61,16,https://www.reddit.com/r/cobrakai/comments/1iwgjak/any_other_middleaged_adults_cry_during_this_season/,immediate,general_reaction
1ir01e9,"The last5 episodes are absolutely perfect, I’m a 28 year old man in tears❤️.","The last 5 episodes are some of the best things i’ve ever seen! So many emotions, Johnny’s scene with Kreese , the proposal to Carmen , Johnny’s scene next to his mom’s tombstone and Johnny finally getting the house got me so emotional I even started crying.

Johnny Lawrence is top 10 TV characters of all time. ",1739733508.0,381,66,https://www.reddit.com/r/cobrakai/comments/1ir01e9/the_last5_episodes_are_absolutely_perfect_im_a_28/,immediate,general_reaction
1itenji,What made you tear up/cry in Part 3?,"What scene made you tear up/cry? I thought it might be a victory in the tournament for me.. but it ended up being the LaRusso family goodbye at the airport. I was reminded of my own final goodbye with my family when they dropped me off at college 23 years ago and it really hit me in the feels, especially Amanda’s emotions. ",1739994407.0,8,44,https://www.reddit.com/r/cobrakai/comments/1itenji/what_made_you_tear_upcry_in_part_3/,immediate,scene_discussion
1iwag0m,Worst and Best things about the finale,"I love this show and I have to say it really helped me in difficult years of my life, especially during the pandemic. I gotta say though, Netflix's strategy of splitting these final seasons of their biggest show (I'm thinking stranger Things too here), while also having 2 or 3 years in between seasons is killing me. 

THE WORST: I watched Part. 3 of season 6 and I'm very aware of how little emotional release I got for a show and for characters that I deeply loved for nearly a decade. In the final fights of Tory and Miguel and Robby I felt NOTHING. In the final moments of Kreese and Silver I got NOTHING. 

  
This make complete sense of you think that these were the 3rd or 4th times that we were watching these kids ""final matches"", the 3rd or 4th times we were watching the ""final showdown"" of Kreese and Silver. 

They dragged everything for way too long. Two thirds of Season 6 was filler, the stew was so watery at this point that I struggled to find any taste in it. And it's not just about repeating the same things over and over, or the filler empty million speeches between the characters... it's also a matter of ruining any momentum and flow of the story. 

Start and stop and start and stop and... wait, why is Silver back again? Oh, he's dying... didn't that deserve a little more depth maybe? Wait, why are back to being in the Cobra Kai dojo after the whole Miyagi-do exodus... didn't that deserve maybe a little more time after 6 seasons? But they couldn't do that, because they had too much to cover in 5 episodes so...

I think the show runners did their best with what Netflix forced them to do. I think this reflected on their budget as well: how come the Sekai Takai was so small and empty? No people in the stands at all? And it's a world tournament? Same for the All Valley, the first seasons it felt much bigger. But they had to use the budget of a season for 15 episodes and also put a big part into that horrible CGI Mr. Miyagi that looked like shit. 

  
THE BEST: in all of this remains the fact that the show runners of Cobra Kai deeply understand their audience. They chose to give the biggest stage to completing Johnny Lawrence's arc, give him his win and I didn't think that would have happened and I deeply resonated with it. Also having there Daniel helping him made complete sense: Kreese couldn't be that for him anymore, he never could, but Daniel had done already what Johnny still needed to do, so... he was really the only person that could help him in achieving that. In a way in all of Cobra Kai Daniel was always good, he had already won all this time. It was Johnny to always have unfinished business with himself that needed resolution. Top notch. I'll miss these people. ",1740318263.0,6,6,https://www.reddit.com/r/cobrakai/comments/1iwag0m/worst_and_best_things_about_the_finale/,immediate,general_reaction
1iu9l95,That finale was absolutely perfect,"Honestly, I can't think of a better way to end this show. They didn't just wrap things up, they actually gave each character, each relationship the satisfying growth we've been watching for years.

Johnny completes his circle, finishes his fight, takes Diaz kid to the top, gets back with his son, cultivates a life full of fulfilment and finds a true family, people who actually love him. And that fills me with pure joy.

And Miguel having a dad figure and a new life ahead of him and being the real face of this show, the real ""Karate Kid"" 

These two were the only reason I watched the show and even had to watch stupid sam and her listen to her stupid lectures but now it is so worth it lol

Anyways, whoever wrote those characters, Johnny Lawrence and Miguel Diaz, they absolutely nailed it, crafting arcs that were so natural and satisfying.",1740086111.0,15,0,https://www.reddit.com/r/cobrakai/comments/1iu9l95/that_finale_was_absolutely_perfect/,immediate,general_reaction
1irl9ye,Great finale to the show but...,We never get to see Johnny's reaction to Kreese and Silver's deaths on the yacht. I think it would've made it interesting if Johnny had learned about their deaths right before the fight with Wolf.,1739803139.0,12,6,https://www.reddit.com/r/cobrakai/comments/1irl9ye/great_finale_to_the_show_but/,immediate,general_reaction
1j8lt7z,Are you happy with Cobra Kai’s finale or would have you preferred this alternate finale?,"So my friend and I have been debating on whether they killed Kreese and Silver off too early or not. I personally am 100% happy with the final episode of Cobra Kai Season 6. It pretty much went back to the feel of the early days of the show and it was a nice fair (Apart from a couple of dirty hits from Wolf at the beginning of the fight) and it gave Johnny a happy ending where he finally got the win of his dreams!

My friend on the other hand, was more interested in the potential storyline of Silver trying to kidnap Johnny’s family (Not sure what he would’ve done to them) and Johnny would’ve had to save them. My friend thinks An alternate final episode where either Silver kills Kreese without blowing the Yacht up or where Kreese doesn’t board the Yacht at all and helped in another way would’ve been a better finale, probably would’ve been similar to the Season 5 finale. 

While I do agree that they should’ve done more with Kreese and Silver in these final 5 episodes (Both of them barely got any screen time or anything imo), I’m honestly glad that they brought back the Season 1 feel for the final episode.

Anyways, my friend and I have been having this debate for hours, but what do you all think?",1741680532.0,31,49,https://www.reddit.com/r/cobrakai/comments/1j8lt7z/are_you_happy_with_cobra_kais_finale_or_would/,immediate,general_reaction
1ivq5p2,Cobra Kai did justice to almost every OG character.,,1740250729.0,1163,111,https://i.redd.it/xhh43ioomqke1.jpeg,immediate,general_reaction
1iqxinn,best full circle moment of the show,"been waiting six seasons for them to address johnny saying “you’re alright, larusso!” so i was cheering during this scene!!",1739727287.0,744,54,https://i.redd.it/o8ak6pcfejje1.jpeg,immediate,scene_discussion
1irzt6c,It’s amazing how this show managed to bring everything together in a full circle,I love Johnny Lawrence man. Cobra Kai never dies 🐍🧡,1739839174.0,391,26,https://www.reddit.com/gallery/1irzt6c,immediate,general_reaction
1it559m,"For a character often vilified, Daniel LaRusso ended as one of the greatest characters ever","Daniel is, imo, one of the most misunderstood characters in this show. The trauma he experienced at the hands of Cobra Kai is often overlooked or minimized. However, the last three episodes especially cemented Daniel as one of the best characters ever written. A previously bullied kid who learns to not only forgive his bully but also the dojo which terrorized him for years. A man who put faith in his friend and helped him achieve his dream and will now lead the next generation of karate kids alongside that friend. Daniel finally became the sensei he was always destined to be 💜",1739970734.0,796,144,https://i.redd.it/w2bp2mkbi3ke1.jpeg,immediate,character_analysis
1itvpye,Johnny Lawrence finally got the ending he deserved,"Season 6 of Cobra Kai wrapped up in a really genuine way. It was awesome to finally see Johnny Lawrence and Danny LaRusso, played by ""William Zabka"" and ""Ralph Macchio,"" come together as best friends. After all those years of rivalry it felt so real and organic. Johnny got the redemption he deserved and Danny showed solid growth too. The rest of the cast was great as well—Miguel Diaz, played by ""Xolo Maridueña,"" really stood out with an awesome performance that's opening up more opportunities for him in movies and TV shows. What I love about Cobra Kai is that it proves you don't need a huge budget to create a memorable show. The '80s vibe is in every set piece and fight scene and it all feels authentic. I've been watching since season 1 and it's bittersweet to see it end, but I'm excited for what's next, especially with the new Karate Kid movie coming up. Overall, I'd give it an 8 out of 10 for delivering a nostalgic, fun ride that gave its characters the heartfelt ending they deserved.

",1740048292.0,55,4,https://www.reddit.com/r/cobrakai/comments/1itvpye/johnny_lawrence_finally_got_the_ending_he_deserved/,immediate,general_reaction
1j1xxgj,I'm so sad that this show ended 🥹,"I have watched a ton of shows before and honestly no other show hit me as hard as Cobra Kai did... I watched the original Karate Kid trilogy like a month ago and decided to binge watch the whole cobra kai series... I was instantly hooked up and completed the whole series in like 3 days and I miss all of the characters soo figging much already... I felt connected to this show and I cried like a little baby when the show ended. 

I just can't imagine the happiness of the people who have waited for something like this for 40 years after watching the original trilogy without even realising that they needed it.

Ralph and William both are absolute legends to come back and do this series. Thank you the whole team of cobra kai for bringing this whole show to life.",1740940795.0,229,50,https://www.reddit.com/r/cobrakai/comments/1j1xxgj/im_so_sad_that_this_show_ended/,immediate,nostalgia_goodbye
1kbpab7,Seeing Daniel in that gi was one of the best moments of the finale,,1746041773.0,1181,54,https://i.redd.it/z4y8a4ymy0ye1.jpeg,immediate,scene_discussion
1lk4k1o,"Johnny Lawrence: confident, competent, troubled","After finishing CK, I’ve found myself satisfied with Johnny’s character arc and how he’s managed to overcome his problems.

He’s a confident fighter, a competent martial artist but he was a very troubled man.

To me, losing the All Valley Tournament wasn’t his downfall. It was the rejection he faced from Kresse after he lost.

In KK1, he seemed to have accepted that he lost and went as far to hand Daniel the trophy himself. But the reaction from Kresse is what made him spiral and wreck his life.

Kresse was the only male role model and father figure he had, the one who was actually interested in his wellbeing and progression.

The way Johnny was treated by Kresse in ‘84 is what made his resentment of Daniel grow. If he won the tournament, he’d still have Kresse’s support and respect.

Seeing him overcome all of that was a huge relief for the character and the audience. It’s satisfying that he buried his issues with Daniel and reclaimed his life by claiming Cobra Kai and making it is own - creating a new story for himself and a legacy his son, step-son and daughter can be proud of. ",1750855127.0,151,37,https://i.redd.it/rabhl0g7j29f1.jpeg,immediate,character_analysis
1mo5rcb,Can we talk about the end of s6?,"I loved the ending for Kreese and Silver. Very well done. Kreese got his redemption arc, Silver was irredeemable.  They didn't rush it, we got just enough time for the switch to flip for Kreese and him apologizing to Johnny was great. 

But.... 

Isn't it kinda weird that the two guys died at the end of e14, and then in e15, it's like they never existed?  We got zero reaction from any of the characters. Even just a scene of Johnny watching TV and seeing it on the news, and shedding a tear, would have given the ending a little more closure, yeah? 

Or am I crazy?",1754996981.0,25,19,https://www.reddit.com/r/cobrakai/comments/1mo5rcb/can_we_talk_about_the_end_of_s6/,immediate,general_reaction
1ofmepk,"I miss this show, despite the ups and downs","Regardless of what the general audience says, this show was something spectacular.

I remember forcing my mom to rent the karate kid movies at blockbuster's and fast forward watching Jackie Chan's Karate Kid, but man, this show, this was something else, I remember watching it on YouTube red when season 1 came out and had such low expectations, but it exceeded my expectations. Yes it was corny and cheesy, but man the big 3 really fleshed out the characters and made this a show that I'll remember for years. The new movie was okay nothing too special but this series will have a place in my heart. 

I keep rewatching it as it's my comfort show but yeah, this was (to me at least) something special which I'm glad I got to experience. 

I haven't posted here in awhile but this show will always have a place in my heart.

COBRA KAIIIIIIII ",1761381181.0,40,34,https://www.reddit.com/r/cobrakai/comments/1ofmepk/i_miss_this_show_despite_the_ups_and_downs/,immediate,nostalgia_goodbye
1khry7b,"The ultimate irony of Kreese's ""No Mercy"" philosophy and his final ending","Kreese lived by the code of never showing mercy and never showing weakness.

However, it was only by finally showing vulnerability and compassion towards Johnny and Tory that his dream of making Cobra Kai live on finally came true.

Sure it's a TV show, but there's a good message to take away: it's never too late to put good out in the world, and you can bet good will finally come back to you.",1746715670.0,28,6,https://www.reddit.com/r/cobrakai/comments/1khry7b/the_ultimate_irony_of_kreeses_no_mercy_philosophy/,immediate,character_analysis
1kl8068,I finally finished season 6. Thoughts…,"I was so worried that after S6 part 1, I wasn’t going to be satisfied with the ending as I’ve adored this show since YouTube Red days.

I’ve loved The Karate Kid since first seeing the movie in 1991 when I was 5 years old and I honestly put off watching S6 part 2 for the longest time, but I finally watched it and it surpassed everything I could’ve hoped for.

It’s bitter sweet knowing that it’s over now, but my god, it was the ride of a lifetime.

It was nostalgia, it was joy, it was closure.

It made what I just watched feel so monumental and almost personal.

What an incredible experience - I’m so happy that I got to experience the movies as a kid only to then be blessed with this gift of a show.

Wow 🥹
",1747094452.0,13,1,https://www.reddit.com/r/cobrakai/comments/1kl8068/i_finally_finished_season_6_thoughts/,immediate,general_reaction
1looj69,Robby's ending is great in my opinion,"



https://preview.redd.it/03fs41alv5af1.jpg?width=640&amp;format=pjpg&amp;auto=webp&amp;s=b9d45ccd44bc283e04417ec70a77c46619951c6d

Like I know he did not win the tournament but in the end he got everything he ever wanted in his life. He got both his parents in his life, A loving girlfriend who also does the same sport as him, A best friend/stepbrother, and career in Karate which will make him a lot of money.",1751331470.0,128,56,https://www.reddit.com/r/cobrakai/comments/1looj69/robbys_ending_is_great_in_my_opinion/,immediate,character_analysis
1jzruff,Why Johnny &gt; wolf at the end of the series,"I don’t like how people keep saying stuff like “oh Johnny only won because wolf was holding back” or “if wolf wanted to win he would’ve but he kept cheating” with nothing to back it up when the show itself explains why Johnny is the better fighter at the end of the tournament. Lets recap.  
Sensei wolf was planning to use the shaolin sunset on Johnny knowing it was a banned move and that it would result in his disqualification. From what we’ve seen, using it can result in death or at least serious injury to somebody given that being hit with it caused the man to have a seizure. So for him to use it in the tournament meant that he didn’t care about winning or losing, he just wanted to deal as much damage as he could to Johnny. This can also be seen in the fact that he had thrown cheap and/or illegal shots at Johnny at plenty of other points in their fight not knowing whether or not he would be severely penalized for it. Even when he was told that any more foul play would lead to a deduction, he completely disregarded Vidal and continued to throw another illegal shot. In other words, he was going all out to try and hurt Johnny as much as possible, disregarding the rules of the tournament. Despite this, Johnny was still able to win and without any dirty moves either, since the shaolin sunset wasn’t the only illegal move wolf used in that fight. This all means that if this translated to a street fight, wolf would essentially be fighting the exact same way he did in the tournament, trying to purely deal damage while Johnny would have been fighting even better than he had in the tournament, knowing that anything goes and knowing he wants to win the fight at any cost. Jesus Christ we see him take down 5 ninjas in s5 because of the street fight mentality and people still can’t connect the dots. And for those who think “oh but wolf has trained so much longer than Johnny” is a valid excuse for wolf being stronger than Johnny are just as mistaken. If there’s one theme we’ve seen throughout the franchise, it’s that experience doesn’t matter in these fights.  

TLDR: wolf was going all out in the fight and Johnny was still able to beat him without breaking any rules. In a street fight with no rules the result would still be the same with Johnny winning since he wouldn’t have to hold back. ",1744723578.0,26,41,https://www.reddit.com/r/cobrakai/comments/1jzruff/why_johnny_wolf_at_the_end_of_the_series/,immediate,character_analysis
