post_id,title,body,created_utc,score,num_comments,url,bucket,post_type
1j8ij6u,I’m going to miss this badass show,"This past weekend, my wife and I got to finish up the series and holy fuck, was it fantastic!!

Going in, I knew a few things that would happen, and there was half a season’s worth of episodes to wrap it up. 

Cobra Kai is one of those shows that demand binge watching!! I forget how much I love this show until I watch it! This series has never had any right to be as good as it has been, right from the start!!!

Things I enjoyed about the last season, and particularly the final batch:

Kwon was a cool, if rather cocky, character. It makes sense Kreese was drawn to him specifically. He had a fire inside him Kreese felt he could exploit. If it hadn’t been spoiled, I would have been surprised by what happened with him. My five year old son was bummed because he was his favorite character haha

Moving on, the exploration of Tory/Robbie felt almost genuine. By that, some of us have known or experienced a couple who go through something traumatic and pulls away.  My sappy ass was happy the show went the happy ending route with them two. 

The way the story wraps for Kreese and Silver, while goofy in the modern sense, felt very 80s action show. That’s some A-Team/Magnum/Miami Vice/Knight Rider stuff! I was happy to see Kreese make peace with who he became after learning his backstory. He’s still a bastard, but in his twilight he managed to make peace with his demons and FINALLY make things right with Johnny.

And Johnny, oh Johnny boy…

Johnny has always been my favorite, so seeing him finally get his come uppance brought happy water to my eyes!!

That last fight with Wolf, when he bowed to Kreese,  man, I wish there had been a quick cut to him when Johnny FINALLY SWEPT THE LEG and WON!!!

Holy shit, I yelled out loud “He did it! Johnny swept the leg!!!” My wife simply grinned at my 80s-born cheesiness haha

And that last scene. Wow. The series came full circle and pulled off an ending that embodies the phrase “Cobra Kai never dies!”",1741666689.0,10,0,https://www.reddit.com/r/cobrakai/comments/1j8ij6u/im_going_to_miss_this_badass_show/,immediate,nostalgia_goodbye
1j7p4t3,I can't believe it's really over...,"So last night I finally watched it all, it took me long because I didn't wanna let it go but I had to eventually and...words can't explain how I feel. I'm sad that it's really over, what a beautiful show this was. It was so crazy seeing the fights at the end...wow😢 wow don't know what else to say...most people don't feel what I feel about the show because they don't feel the same way about life as I do... I am grateful that I found out about the show even though I did find out kind of late lol. And honestly seeing season 4 is what really got me into it...I've never loved a TV show more. People can say what they want of course the greatest things and the greatest people have haters and people who wanna talk shit but... Even tho the show is over... Cobra Kai never dies love all the characters and actors love everything about the show(except maybe a few things) and goodbye to a TV show that isn't just a TV show but... something bigger than that love watching it and I forever will💯❤️",1741575903.0,11,3,https://www.reddit.com/r/cobrakai/comments/1j7p4t3/i_cant_believe_its_really_over/,immediate,nostalgia_goodbye
1iu0elq,Cobra Kai's ending is almost perfect. And I still didn't get over the ending of Game of Thrones.,"To be honest, I can't say I've 100% enjoyed Season 6 Part 1 and Part 2. While the fights looked impressive, from the writing point of view there were a lot of things I didn't really like. Like all those love triangles again, IMO the whole brawl fight didn't really make sense. Kreese lost the knife in the dumbest way possible and then Kwon fell on it... I don't know, man.

There were many other things, but the thing is, this show never had and never intended to have Breaking Bad, Better Call Saul, or Sopranos level of writing. There was always some cheesiness and corniness with everything in the show, there were always those teenage love triangles, etc.

While it's not Breaking Bad level of writing, the writers still put a lot of respect and thought into many of the characters and philosophies from the OG films. They treated all the characters with respect.

While S6 Part 1 and Part 2 were questionable, they really pulled off a great series ending in Part 3. All the characters completed their arcs, and the writers pulled it off in the best and most natural way possible. The whole Kreese redemption arc with Johnny and Tory felt amazing. Kreese and Silver went off like true fighters. The whole Johnny and Miguel arc. Daniel's help with returning to the original Cobra Kai dojo from Season 1. The whole Johnny and Daniel arc. The writers really did a good job.

And it kind of reminds me of Game of Thrones, you know. Seasons 5-6-7 were questionable, there were a lot of dumb things in the plot. But it still was really enjoyable, there still were a lot of great scenes and great epic storylines. And before Season 8 Episode 3, the show was arguably at its peak. The whole buildup to the fight with the Night King throughout all the seasons was huge. The hype was huge. Yes, there were a lot of questionable and dumb things, like what they did with the Littlefinger, etc. But we as an audience still had hope that the writers would treat the main plot and all the main characters with respect. That the writers won't destroy the whole storylines and character arcs for no reason at all.

And, well, you all know what happened next. And the thing that hurts the most, is that D&amp;D didn't really need to pull off some George R. R. Martin level of clever writing. No. They just needed to treat the characters and storylines with respect to everything that happened in previous seasons. The same way Cobra Kai writers treated all the main characters and pulled off a good ending. Sure, it's probably not perfect from the writing point of view. But it works. And Game of Thrones too could have a good ending that could work. Not the perfect one. But the one that could really work. Not this Bran The Broken kind of nonsense.",1740063556.0,13,12,https://www.reddit.com/r/cobrakai/comments/1iu0elq/cobra_kais_ending_is_almost_perfect_and_i_still/,immediate,general_reaction
1ow6nwc,The Full Circle moment between Daniel &amp; Johnny was Bitter Sweet and Satisfying,,1763053700.0,1221,72,https://i.redd.it/mhnxw8xr321g1.png,immediate,scene_discussion
1jfa9p3,Johnny and Daniel’s ending was a perfect example of how there is no “one way”,"*I saw a post about this just recently and this is inspired by it*

Johnny taking back cobra Kai at the end and Daniel teaching at miyagi do but not as enemies as friends was perfect because it calls back to season two “I’ll always be miyagi do and you’ll always be cobra Kai but that doesn’t have to mean we need to be at war”.There is no correct one way and Daniel can be miyagi do and Johnny can be cobra Kai because that is who they are as individuals,but it doesn’t mean they need to argue which is why I didn’t like Johnny  being in miyagi do because it’s not naturally who he is.However,I do like that they teach both styles now because for me the whole point of them doing that is to show their is no “one” way.",1742424723.0,60,20,https://www.reddit.com/r/cobrakai/comments/1jfa9p3/johnny_and_daniels_ending_was_a_perfect_example/,immediate,character_analysis
1k0q23a,Anyone else agree with Daniel during her farewell?,I,1744824257.0,479,109,https://i.redd.it/5vod664ae8ve1.jpeg,immediate,scene_discussion
1jbb57y,Just finished S6 of Cobra Kai. Who else agrees Johnny had some of the best character development?,"My boy dragged his self out of one deep ass hole, went from a drunk, to a caring man who started a family with one of the most beautiful women on the show, took care of Miguel like his own kid, and he patched things up with Robby, Johnny definitely gave me a change of heart. ",1741978188.0,115,78,https://i.redd.it/roauxl8ibpoe1.jpeg,immediate,character_analysis
1k53fj0,"Best scene in the series, this is the best scene in season 6",,1745319514.0,26,9,https://youtu.be/sgh0XiLVfOA?si=mV0znb1lFMc0xx2m,immediate,scene_discussion
1itp1yw,"In your opinion, do you think it should’ve always ended with Cobra Kai redeemed or another way?","Now that everything is said and done. Cobra Kai is back once again, but hopefully in a forever positive light. 

Do you believe the series always had to end with Cobra Kai being redeemed for real this time or would you have been fine with them ending it in a different way? 

My thoughts, I would’ve been fine with it either way. I made a post about this a while ago and I still believe this, but not everything has to be entirely full circle. Ending the series with Johnny’s Cobra Kai again wouldn’t had been a bad thing and it ended up becoming true, which I do like how they ended with that (for the most part…) but I also would’ve been just as fine with the series ending with Cobra Kai being gone for good. Dying with the people that made such a a contentious stream of poison, i.e. Kreese, Silver, Master Kim, you get the point. 

But, what about you?

",1740022338.0,34,56,https://www.reddit.com/r/cobrakai/comments/1itp1yw/in_your_opinion_do_you_think_it_shouldve_always/,immediate,general_reaction
1ry9jrd,Finally finished the last season!,"I know it's a bit late but I finally finished season 6! 

How they did the last three episodes hit hard emotionally, I actually cried at the parts like Kreece and Johnny coming together at the end, bringing Cobra Kai back, Miggys entrance with Tori, Miggy and Tori's massive wins, Johnny finally getting it all, winning the Sensai part, Daniel bringing back the building for Cobra Kai for Johnny and them working together bringing the best parts of their own karate styles for the kids. 

Kreeses sacrifice was bittersweet, the man showed he truly loved Johnny at the end 

Thank you to the creators and actors for closing the Karate Kid story perfectly! 

Sorry I have no where else to post 😅

Cobra Kai Never Dies! ",1773947427.0,34,23,https://www.reddit.com/r/cobrakai/comments/1ry9jrd/finally_finished_the_last_season/,long_term,general_reaction
1irjt35,Thoughts on the season finale?,"Going into the third part of the final season, I felt ready for the series to be over. In Part 2, it started feeling a bit too dramatic, and I thought they were dragging it out unnecessarily. But…

The third part redeemed itself, and overall, I think they did an excellent job with the ending.

I loved seeing Kreese turn from heel to hero. There were a lot of hidden messages in that storyline, especially in how it concluded. As parents, we can often be like Kreese—pushing our kids so hard to succeed, only to one day realize we may have pushed too hard, leading to a heartfelt apology.

Having lost a parent at a young age, I really appreciated how they wrapped up Johnny’s story—taking the picture to the grave, reflecting on how much his life had changed, and recognizing that his longtime rival, Daniel, was one of the people who helped turn his life around.

Overall, I was very impressed with how they closed it out. What are your thoughts?",1739798852.0,15,20,https://www.reddit.com/r/cobrakai/comments/1irjt35/thoughts_on_the_season_finale/,immediate,general_reaction
1izjh55,The series finale was brilliant.,"I feel like finales are hit and miss.   
Some are weak sauce (Seinfeld, Lost, Suits, Game of Thrones) some are phenomenal. (The Americans, Breaking Bad)   
They either feel really rushed to tie up any loose ends in the final 10 minutes of the show, or are about everyone going theor uniquely separate ways to other states or countries, or they don't tie up anything and make no sense (looking at you, **Lost**)  
But Cobra Kai nails it.  
It's a redemption story for &gt;!Johnny!&lt;.   
The pacing was perfect.  
It still has that cringe thing where a number of characters are moving out of town all at the same time, but it didn't feel as forced and awkward as in so many other shows.   

Bravo to the writers, producers, and director to getting this done so well.   
Well done 👏 👏👏👏",1740672895.0,76,27,https://www.reddit.com/r/cobrakai/comments/1izjh55/the_series_finale_was_brilliant/,immediate,general_reaction
1irn3lz,Season 6 Finale Thoughts/Missed Opportunities,"My Thoughts on Part 3 of Cobra Kai Season 6

Ok, so these are just my thoughts on the final part of Cobra Kai Season 6. I really love this show and have been watching since it was on YouTube. After finishing the final episode, my feelings went from being happy—because of all the hyped moments like Tory winning, Miguel’s return to Cobra Kai and his victory, Johnny’s epic match at the end, etc.—to something more mixed. The more I thought about it, the more I felt… not necessarily sad or disappointed, but just not fully satisfied either.

I believe this is because quite a bit felt missing, and with only five episodes to wrap everything up, there wasn’t enough time to include everything that needed to be there.

I just want to start by saying that this is purely my opinion. Everyone’s thoughts are subjective—some may agree, some may think differently—but this is just how I feel. I also could be wrong about certain things I say, and if anything I’m saying doesn’t make sense or can be corrected, I apologise.

Now, I feel like these final five episodes were a bit rushed, and I personally think there was a bit missing and some things that bothered me just a little bit.

Axel’s Loss
- I don’t think Axel should have been beaten as easily. In Part 2, he was pretty much unstoppable—he hadn’t been touched once throughout the tournament and fought Robby and Miguel with ease. I understand that he had to get hit and lose at some point, but I feel like it could have been done differently. I’m unsure on exactly how, but Robby using the VR to train against Axel and then just go in and start scoring all these points on him felt a little meh. (But hey, maybe I’m wrong, and the writers are just showing how good Robby has gotten or just is)
With Miguel, it felt somewhat similar. As far as I remember, we don’t even know for sure if he used the VR to train against Axel, but based on how well he performed, i guess he’s just simply better.

Robby’s Injury
- I kind of expected Robby to get injured, leaving Miguel to take the winning spot, but man, I felt bad for him after that. He lost the first All Valley, lost the second All Valley, lost most of the Sekai Taikai in Part 2, and then, when it looked like he had a shot, he didn’t even get to finish his fight with Axel. Then at the end, all we see is that he and Tory got their karate endorsements—but that’s it. No final scene with his family or anything. That felt a little sad.

Sam Dropping Out
- It was kind of disappointing that Sam dropped out as she and Tory should’ve finally had a fair match against each other. But I guess she had to as Miyagi-Do wouldn’t have won regardless of how well she performed

Missing Character Interactions
- There were certain character interactions that we didn’t get which I would’ve liked to have seen for example:
    * Axel and Sam - this one was quite disappointing as all they do is look at each other. Sam knew what Axel was dealing with and never had any dialogue with him or anyone else about it but even any interaction would’ve been good to see between the two. 
    * Axel and Zara - This interaction would’ve been good to see as they are from the same dojo and are the best. They could’ve talked about their sensei, their training or just whatever the writers could’ve came up with. 
    * Robby (or Robby and his teammates) and Axel  - This could’ve been good like after the tournament was over Axel could’ve maybe went on a apology run and I believe some good scenes could’ve been made from this
(I feel there’s more to put here but I’m failing to think of more right now)

Other Things That Felt Missing
- Kreese’s death should have been known by others or even acknowledged by at least Johnny. Maybe even a brief reaction scene.
- More epilogues as maybe we should have seen more about what happens to certain characters like Robby, Tory, and Chozen for example.
- A Family Scene With Johnny, Carmen, Miguel, Robby, &amp; Laura as It would’ve been cool to see them all together.
- A Miguel &amp; Hawk Scene as a final moment between them would have been nice. Although Their last scene of lifting Johnny in celebration was pretty great.
- Maybe more should’ve been done with Axel. After he lost to Miguel they actually kind of had me feeling bad for him. Some scenes afterwards of him could’ve been a good idea possibly.

There may be some more that I’ve forgotten or that just isn’t coming to me right now but what I have so far are the main things that I think about instantly.
 
Overall, I still love the show, and there were a lot of great moments in this final part. But this post is more about how I personally felt about what happened and I can’t help feeling like there were some missed opportunities. I do keep in mind still that they only had 5 episodes left but they still made something great in the end. 

What do you guys think? Did anyone else feel this way, or am I just overthinking it?",1739807914.0,42,25,https://www.reddit.com/r/cobrakai/comments/1irn3lz/season_6_finale_thoughtsmissed_opportunities/,immediate,general_reaction
1irhmsj,🏆 Cobra Kai Never Dies. What a bad ass ending.,"Cobra Kai never dies 🐍 
You’re the best… 🎵 around… 🎶 ",1739791113.0,903,113,https://www.reddit.com/r/cobrakai/comments/1irhmsj/cobra_kai_never_dies_what_a_bad_ass_ending/,immediate,general_reaction
1isp4qn,Best ending to a series in 20+ years,"That was the best ending to a tv show I've seen in at least 20 years.  Sure, I thought the show was very corny at times, and some of the acting was poor, but the nostalgia it gave me throughout the entire show was very welcomed.  I loved the way Johnny grew up and how Daniel learned to embrace Johnny's strengths, especially that finale episode.  I was on the verge of tears that entire episode.  It made me happy and I'm going to miss this show.",1739917833.0,253,93,https://www.reddit.com/r/cobrakai/comments/1isp4qn/best_ending_to_a_series_in_20_years/,immediate,general_reaction
1itmm7f,One of the most satisfying series endings ever!,"I'm simply trying not to annoy my friends by talking about this when they literally could not care less but oh my gosh the final 2 episodes of Cobra Kai were nearly perfect. The sensei fight was perfectly cheesy and then perfectly epic. Johnny's full circle redemption ark overcoming being a bum was so satisfying. Johnny and Daniel finally fully accept each other. Johnny admits his failures which took him so long to do. OH MY GOSH I loved when Tory won because she realized she was loved! Another example of the perfect amount of corny. That wasn't eloquent, but all that to say, the finale scratched the itch for me. It was so good. ",1740014972.0,65,14,https://www.reddit.com/r/cobrakai/comments/1itmm7f/one_of_the_most_satisfying_series_endings_ever/,immediate,general_reaction
1iu95ve,Cobra Kai is over and I’m ok with that,The show has had its finale and I could not be happier with how it was all resolved. I think the most surprising yet satisfying part was the resurgence of Cobra Kai under Johnny’s administration and their ultimate victory at the sekai taikai. It was a great way to bring things back to the starting point to show how far things have come. And it was a good way of returning Johnny to main protagonist status. It was quite cool to see Daniel and Chozen training him for his tie breaker fought with sensei Wolf. ,1740085053.0,30,0,https://www.reddit.com/r/cobrakai/comments/1iu95ve/cobra_kai_is_over_and_im_ok_with_that/,immediate,general_reaction
1j4y961,Just watched the finale and wow,"I was really afraid the show won’t stick the landing after a rather successful first few seasons, the last few episodes are amazing, I LOVED every moment of it, I think it went over the top in the right places, they tied everything up in a very neat and fun way and I loved the ending for all the players, it feels like this was done with great passion by the actors and producers and I am so happy this series came out!

One of the rare Netflix W’s imo, usually they would cancel a good show like this.",1741275582.0,47,16,https://www.reddit.com/r/cobrakai/comments/1j4y961/just_watched_the_finale_and_wow/,immediate,general_reaction
1j0jsgh,Wow. Just finished the show. My thoughts:,"let me just start by saying WOW. What a masterpiece. Did this in under a week and i just cant believe how good that show was. All of the little references and call backs to earlier seasons was just put together so well. The charcter development of every main charcter is insane. they all develope compared to their first apperences by such a larhe margin. Never loved the ending of a show so much. Johnny ""geting his flowers"" and leaving the photo of his family by his mothers grave were both perfect. And my last thing is Miguel might be one of the best written charecters ive seen in a minute. From lower middle class boy who got bullied to an all valley champ and beating an unbeatable student of iron dragon to become champion of the whole world. I just wish i could watch it for a first time again. ",1740780660.0,28,5,https://www.reddit.com/r/cobrakai/comments/1j0jsgh/wow_just_finished_the_show_my_thoughts/,immediate,general_reaction
1irr0z1,Daniel finally finding balance,Did anyone else love how Daniel realized to find balance with Miyagi Do and Cobra Kai? I know the dojo haunted him the original series but he realized Johnny was not like that. He went all in and even wore the uniform to support Johnny.,1739817269.0,10,1,https://www.reddit.com/r/cobrakai/comments/1irr0z1/daniel_finally_finding_balance/,immediate,character_analysis
1irmcwr,My favourite part of the finale,,1739805998.0,642,34,https://www.reddit.com/gallery/1irmcwr,immediate,scene_discussion
1ir700g,Cobra Kai Finale could’ve benefited HEAVILY from being a full 7th Season,"First off, I’d like to say, I LOVED this entire season and this series as a whole, it definitely had its moments, especially season 6 but overall, I absolutely adore this series and will forever be my fav… however, I think this season was missing 5 more episodes.

I remember an interview where Josh, John, and Hayden said they they were originally going to do a full season 7, I forgot the reason they said that they shortened it but I think they should’ve just committed to a full 7th season. 

Firstly, season 6 part 3 was incredibly fast paced and it felt like they sped through every plotline and character arc. By the way they showed everyone’s reaction to literally watching a kid die in front of them, I was so sure that their trauma from that experience would be explored more but instead, they constantly joked about it or undermined it. maybe we could’ve seen the direct aftermath of the ST in a potential S7E1 instead of a 2 month timeskip.

Also All of the character dynamics could’ve been built up to the conclusion a lot more thoroughly like Tory and The Korean Cobra Kai team (mostly Yoon, Kwon, and Kim), Daniel and Robby, Johnny and Miguel, Johnny and Kreese, Sam and Tory etc. 

Also it would open the door for a lot more “ffan service” for the final season, I’m sure everyone would like to see plenty of things that haven’t been done before in the series, can’t think of any examples off the top of my head but I know y’all can. 

Ngl, although there is a lot more id like to say about this, I don’t feel like writing anymore but all I’m saying is, it was a mistake to do a 15 episode season 6 instead of a 10 episode season 7. ",1739751960.0,18,10,https://www.reddit.com/r/cobrakai/comments/1ir700g/cobra_kai_finale_couldve_benefited_heavily_from/,immediate,general_reaction
