post_id,title,body,created_utc,score,num_comments,url,bucket,post_type
1qieds5,"i just finished cobra kai, and oh my god was it awesome *spoilers*","i loved this series so much i watched it all in a few weeks. the fact that johnny and daniel were able to overcome their rivalry was awesome. and there were some really emotional moments in it too, like kreese finally admitting his mistakes to johnny. that scene actually made me shed a tear. words cant explain how hyped i got at the sekai taikai too. just the overall series were soo exciting to watch! i am definitely rewatching in a couple of months",1768945030.0,60,11,https://www.reddit.com/r/cobrakai/comments/1qieds5/i_just_finished_cobra_kai_and_oh_my_god_was_it/,long_term,general_reaction
1njq68y,Just Finished Cobra Kai. Loved it!,"So I am a little late to the party, but I just finished Cobra Kai and I loved the ending. I must admit that I prefer finales where everyone gets their happy ending and this show delivered on that. 

It's crazy that such an awesome movie (The Karate Kid) turned into a random low budget show on YouTube, and then eventually to this highly rated show on Netflix over 30 years after the movie released. 

For someone who was born around the time that the movie came out, to be able to reconnect to my childhood, was so so satisfying. Absolutely great, and yes ridiculously cheesy, but extremely entertaining at the end of the day! 

With that being said, I see a lot of people didn't like it, which was surprising to me. Many people complained of it being cheap and tacky with poor choreographed fighting scenes, but what does everyone expect when the show is based off of a movie and idea from the 80's? It's supposed to be that way. 

Anyways, what did you guys think?",1758145304.0,73,12,https://www.reddit.com/r/cobrakai/comments/1njq68y/just_finished_cobra_kai_loved_it/,immediate,general_reaction
1kcqxkk,The Legendary Coincidence of the Show Ending in 2025 (The Year of the Snake)🐍,"Another post pointed out how Cobra Kai ended on the [first full moon of 2025](https://www.reddit.com/r/cobrakai/comments/1io6cxw/was_this_intentional_cobra_kai_ends_on_the_1st/), the Year of the Snake🐍. Although most likely a coincidence, it's still cool to think that circumstances led to the show ending on a Chinese Zodiac that reflects its namesake.

One other coincidence that contributes to the ""legendary"" greatness the show exudes was how they introduced the Iron Dragons in the previous year (2024)... which happened to be the [Year of the Dragon](https://thekaratekid.fandom.com/wiki/Benvinguts_a_Barcelona#:~:text=Air%20date-,November%2015%2C%202024,-Written%20by)🐉.

Through a romanticized lens, some might say that the years aligned to tell the story of how the reign of the Dragons ended after the original Cobras (Miguel and Johnny) took back their symbol.

It seems that even fate deemed this story important enough to line up all of these events at the right time. In the words of Johnny Lawrence: ""That's badass""🥋",1746154846.0,47,2,https://www.reddit.com/gallery/1kcqxkk,immediate,other
1nnoazj,I Miss Cobra Kai.  Took It For Granted,"Its been 8 months since Cobra Kai season 6 part 3 dropped and man! do I miss this show.  Cobra Kai has its flaws but it was like taking happy pills while watching it.  I miss theorizing with other fellow Cobra's on what will happen in the next season and the anticipation when the new season dropped.  I honestly believe that there won't be another show like it.  The perfect balance of 80's cheese, drama, comedy and martial arts.  Of course there's decent shows out today but they don't have me on a chokehold like Cobra Kai did.  

https://preview.redd.it/ppzxfyf0aqqf1.jpg?width=318&amp;format=pjpg&amp;auto=webp&amp;s=9f1452c7bf95423dad910328774a0bbef3ef7357

",1758552021.0,186,36,https://www.reddit.com/r/cobrakai/comments/1nnoazj/i_miss_cobra_kai_took_it_for_granted/,immediate,nostalgia_goodbye
1lmr719,Just finished season 6 of cobra Kai and it’s definitely my favorite season. PERFECT FINALE,"Everything about it is perfect. It felt like the final season the moment the first episode started, and they did not hold back whatsoever. 

All the character drama all felt much more natural and better compared to previous seasons bc nobody really were against each other like they were. Like yeah, Daniel and Johnny had quite a few disagreements, but they never lasted or got as bad as previous seasons. It was just a little splatter. They still had each other back. 

Same with Tory going back to Cobra Kai, it wasn’t used to make Tory turn again and have them hate each other again. Everyone in Miyagi-Do knew who Tory really was and wasn’t mad at her. 

All of the emotional moments throughout all 15 episodes and the extra focus on Mr. Miyagi this season was just so special. 

I loved the Kreese redemption bc it actually felt very realistic, which I thought would be impossible, but they pulled it off in the best way. Having him sacrifice himself to take out Silver was a badass way to go out. 

I particularly loved the episodes in Spain bc it was such a nice change of scenery. 

I love how much everybody loves each other now. Johnny and Daniel being best friends that work together and support each other, Sam and Tory forgiving each other and becoming really close, Sam and Miguel being in love and having a healthy relationship, Tory and Robbie loving each other and being there for each other no matter what and even getting to work together, Robbie and Miguel becoming actually like brothers and loving each other, Anthony and Kenny forgiving each other and being cool, etc. 

Everything was just perfect, and they went out in a bang. But Cobra Kai never dies, so who knows? Maybe it will come back someday. ",1751128715.0,23,21,https://www.reddit.com/r/cobrakai/comments/1lmr719/just_finished_season_6_of_cobra_kai_and_its/,immediate,general_reaction
1iz7yly,"""Farewell, Cobra Kai"" - Just one little rant before I go quiet into the night","Well, I just saw the last episode.. and what a ride it's been. Cobra Kai was the perfect blend between nostalgia and new stories, not too much nostalgia so as to overshadow the new characters, but also not too little to the point where you didn't even know it was connected to Karate Kid. It was a perfectly equalized recipe. \^\^

However.

One thing.

One gripe... that I just can't let go of. It soured what should have been a climax of bittersweet emotional release. And yes, this is gonna be a bit of a rant. I beg your pardon, I just need to get this out and then I will move on with my life.

Season 6 truly was the final insult to anyone who wanted Robby to, at long last, win the gold. The poor guy has always been the runner up, and we were many who had waited for, nay yearned for this to be his moment to shine, but once again, Miguel get's the gold. You can see how try-hardy this angle is when the writers just out of nowhere drum up some ridiculous random love triangle drama between Miguel, Sam and Axel. The signs were there from the start, the beef is built up just so that there will be an initial grudge for Miguel to fight him. And since Miguel wasn't a captain, there was only one way that was gonna happen from a narrative standpoint... Robby had to be taken out of play.

This is a step down. In fact, analyzing season 6, I take issue with Robby's nerfed skills as a whole. Even unfocused during the tournament in Spain, he was Miyagi-Do's number one male; this was the guy who single-handedly beat the entire dojo of Cobra Kais already back in season 4 like it was nothing. He should be winning big, but all throughout their stay in Spain, Robby takes a beating like it's his job, and only finds his mojo at the very end, narrowly escaping a loss.

Naturally, I assumed this whole development was because they were going to build him up for the finals, but nooo... turns out it was mainly to have him getting his payback on Kwon; which I am fine with, but it shouldn't have taken away the gold from Robby. Damnit, it was his turn! But no, he is relegated to being a plot device; the writers pretty much sacrificed him and used him as fuel for Miguel to once again win the day. And there is something not right with that. It just felt unfair, unrealistic and borderline abusive of a cherished character.

As soon as Robby was pitted against Axel in the semi-finals, the entire design of this plan was legit laid out bare for anyone to see: Robby was going to get incapacitated in one way or the other so that Miguel was going to have to fight Axel. This was why that nonsensical love triangle had been penned in the first place. It was so obvious, anyone could see it coming a mile away.

Once Robby got injured and in a heartfelt moment confessed to his dad that he was sad that he would never get another chance to prove himself the best, I just lost interest. The final tournament match was barely entertaining since we all knew how it would end anyway; likewise with the sensei duel. And then, cherry on top, seeing Robby hobble around on crutches toward the end was like a final slap in the face from the writers.

From a writer's perspective, they should have just had Miguel dominate Spain, and then he could have become someone who said ""I have had my time as champ, it is your time now"" and then act in a supporting role for Robby, still by all means getting a lot of screen time, but possibly as a personal coach in addition to the senseis, symbolizing the galvanization of their friendship and giving us sort of a passing of the torch. Miguel already won once. But this final development makes it all ridiculously one-sided.

It is basically TMNT 2003 Leonardo in the Battle Nexus all over again. Every single one of my betting horses always break their ankles right before the finishing line because they are either too OP and need a plot device to take them out of play, OR, they are the brunt of a writer's joke, always destined to come in second no matter what.

In conclusion, I still love the show and it is sad to see it go. And I will admit, once I calmed down, the final episodes were a decent send-off. I will always have fond memories of watching it, connecting with the characters and getting more immersed in the stories than I ever thought possible. I just despise the way the writers decided to blueball us who rooted for Robby throughout the entire course of six seasons.

Other than that...

Cobra Kai never dies!!

[#JusticeForRobby](https://preview.redd.it/xmntvglj4mle1.jpg?width=480&amp;format=pjpg&amp;auto=webp&amp;s=698ce2d11b5f381b26e9c8f3da98cedd76d1deeb)",1740631997.0,63,99,https://www.reddit.com/r/cobrakai/comments/1iz7yly/farewell_cobra_kai_just_one_little_rant_before_i/,immediate,nostalgia_goodbye
1j14fzx,"The ending was perfect, people should be grateful","My one an only rant.
Look i don’t get why people have this idea that 
1. Robby got done dirty 
2. Miyagi do should’ve won.

Let’s see the scalings, 
Theyhad Robby beat Miguel in p1 , and gave no obvious indication Miguel was distracted. (Wanted to make it seem Robby is better)

In p2 they had Miguel “lose” to kwon (yet again with no indication) and Robby then straight up manhandles kwon (wanted to make it seem like Robby’s better again)

Every time Robby loses in p2, they show him staring at Tory just standing there so no implication that he’s less skilled or weaker. Just imagine they had Robby beat axel too while miguel got tossed around by him in p2 and he just gets Stanford while supporting Robby? 
Yea no. That’d cement Robby as the better fighter by miles, and that shouldn’t happen since they’re stated to be equals.

Let me make something clear. Losing to an opponent while staring at a girl and standing still does NOT make you a worse or less skilled fighter in the eyes of the audience 
(Robby)
Losing to an opponent (kwon) while focused (never showed otherwise) while the other person humiliates them DOES make you a worse fighter
(Miguel)

Also idk if it’s just me but the whole Miyagi do should’ve won? 
Nuh uh, thank god the writers didn’t do that, that would’ve left a sour taste in my mouth forever. “Your sekai taikai champions, Miyagi do” just won’t sit right.

As for Johnny shouldnt have won he needs to take accountability and take a loss, no. Just no. All of us were rooting with everything we got for him , so my opinion is that sacrificing the epic moment of Johnny winning for  “learning a lesson” “accountability”  is pure bs 



The only way I’d accept Robby winning everything at the cost of Miguel is if Miguel won the captains round and beat kwon, then Miguel got injured. That’d be okay for both storylines",1740849322.0,86,79,https://www.reddit.com/r/cobrakai/comments/1j14fzx/the_ending_was_perfect_people_should_be_grateful/,immediate,general_reaction
1k1ce4q,Cobra kais ending was 100 percent how it should of ended but they went about it the wrong way,"I love that miguel and johnny won and got cobra kai back in just don’t like all the bad writing that had to happen making the ending feel forced

Deaths- 2 people had to die for this to happen torys mom had to die so she would have a spot in cobra kai and kwon had to die for miguel to have a spot. Again torys mom had nothing to do with the story to bring her in as a plot point is just terrible collateral tory dosen’t even seem like she just lost her mother in part 3.

Characters being out of character- johnnys and daniel being at odds is so forced because the writers backed themselves in a corner with miyigi-do they couldn’t let miyigi-do have a lot of points so they had to force a plotline where neither johnny or daniel could be a good sensei even chozen.

Devon lee- To further the devon and kenny problem. In season 4 devon took losing to tory as a motivation that she would be better next time but in season 6 somehow she losses all her confidence which isn’t explained and prevents the team from being at her best this was purely out of character from the person we met in season 4.

Robby kenne- one of the most out of character things is after torys outburst sam robby and Amanda stand around to watch a headband to be put on there head and I’m supposed to believe that? The writers again pushed that under the rug during the Robby and tory issues in part 2 as she says her reasoning is thinking she didn’t have a fair shot. 

Also the whole part 2 robby isn’t performing well again not because he is easily distracted its because again the writers have to find a way for miyigi-do to quit to make sense. He performed bad in every fight just to push the agenda of miyigi-do not having enough points in part 3. And its sad to say he finally got a win over miguel but when you look at it at the grand scheme of things the only reason the writers gave him that win is so that miguel can replace him in part 3.

Eli/hawk- his character is just out of character i dont even have to explain the nerf everyone can see that. He yells at demetri about not taking accountability after lying to his friend about what college he wanted to do for possibly months since he stated since he joined karate he was wondering was someone else. Him and demetri teaming up on kenny is just ubsurd hawk was in the same position as kenny in season 4 chris and the other got on him and didn’t trust him. Now he turns around and treats the kenny the same way was just unbelievable.

Sam- overall her character didn’t have to take a sacrifice but her not fighting in the finale was one. The writers sculpted the whole part 2 to make sure miyigi-do isn’t close enough to the iron dragons so she wouldn’t fight after robby’s injury.

Miguel- again the writers prioritzed miguel over everyone. Despite him losing to robby as captain he still shined in all of part 2 and instead of giving us a chance to see him handle a loss which we should of been able to they give us a storyline where miguel just carries the team. Dosen’t johny teach him no losing? No accepting defeat? And he finally is defeated and they have a opportunity to give him a storyline about him accepting it but instead they ignore it and give us perfect miguel again.


Overally the ending was perfect for miguel johnny and tory. But to many characters had to take sacrifices or be just straight up different people for this storyline to work. I see people praise the ending of part 3 but i simply can’t when robby,Devon,daniel,hawk,Tory characters had to suffer for this to happen.",1744895387.0,19,34,https://www.reddit.com/r/cobrakai/comments/1k1ce4q/cobra_kais_ending_was_100_percent_how_it_should/,immediate,general_reaction
1ioc115,Cobra Kai…Never Dies. I will miss this show so much.,,1739424440.0,1277,185,https://v.redd.it/k4ldeatuduie1,immediate,nostalgia_goodbye
1is4doi,THE ENDING. LITERAL PERFECTION.,"Without spoiling anything huge, the show was LITERALLY wrapped up perfectly. I legitimately cannot think of anything else I would've added or changed, every character got such a perfect ending and the arcs were wrapped up so well. We won, guys🥹🥹 What did y'all love most about part three?",1739853004.0,24,6,https://www.reddit.com/r/cobrakai/comments/1is4doi/the_ending_literal_perfection/,immediate,general_reaction
1kni3bw,Just finished Cobra Kai for the first time and I gotta say...,"HOLY SHIT!! This is the most badass series I've 
watched in a while and the best part is that they didn't screw up the ending of any season which is hard to find nowadays.

They managed to bring back almost every character back after 30+ years. That's WILD. And the best part is, they didn’t just bring characters back for nostalgia’s sake, they actually gave them depth and new purpose.

From Johnny's redemption arc—washed-up loser to a mentor, a father figure, and finally a champion—to Kreese’s layered backstory, and even surprise returns like Terry Silver or Mike Barnes, it all felt earned. And the fact that they kept the Karate Kid spirit alive without making it cheesy is honestly impressive.

John Kreese's confession to Johnny Lawrence at the end made me cry. Idk about others but he really did manage to redeem himself for me. It didn’t erase everything, but it gave him humanity.

Really loved Robby's character development. Dude understood the way of the world and got out of Cobra Kai at the right moment. And Miguel's fights! Miguel always had that winner aura. I always rooted for him. He was the most badass character! 

I also loved the occasional rumbling of the kids and the S06 rumbling was freaking awesome. Literally all the dojos' students as well as their sensei fought each other. It blows my mind how did the team managed to shoot all that and the choreography must have been a hell of a work. The choreography team deserves all the praise. Coordinating that many fighters, giving each key character their moment. 

The soundtracks were also badass. They even brought some of the soundtracks and songs from the original trilogy back. As a non-American and born in the 21st century I'm finally starting to understand why 80s American songs are loved so much. I'd love a few recommendations which are similar to The Karate Kid/Cobra Kai especially like 'Young Hearts'. 

And as for the best fights, I literally binge watched the entire show so I'd have to re-watch the fights a few times but at the top of my head Miguel vs Axel was amazing. And the soundtrack made it even better. There was a time not so long ago that no one including Miguel could've even touch that man. But that fight paired with those flashbacks of his training and his fights against the others made it feel like everything he went through was finally worth it. 
'Miguel vs 2 Dublin Thunders fighters' was also freaking badass. I loved his confidence when he said ""Hey, watch how it's done."" to Robby. That line made me so hyped and the entire scene was so worth it.

I really wanna talk so much more on this but I binge watched the entire thing and it's hard to keep a track of all the stuff that happened in the show. There is a lot of good scenes in every season. 

Thank you so much for this series. I'll forever cherish it.

Cobra Kai never dies! ",1747339960.0,250,44,https://i.redd.it/nefoiz2t601f1.png,immediate,general_reaction
1iu4902,How good was the Cobra Kai SERIES FINALE! Literally this series absolutely smashed it!,,1740073064.0,94,44,https://youtu.be/0NO0Twpj9kY?si=bV9V2vysSZXVGIwF,immediate,general_reaction
1j0h3j3,Cobra Kai never dies. What an ending!,"Cobra Kai has been one of my favourite shows since I saw it for the first time when it came out to Netflix during covid season 3 was coming out so then I watched season 1 and 2 to keep up. I have been watching since then, and what an badass ending. Seriously season was top tier except for my favourite season which is season 4 with prime Robby in CK and Hawk/Eli in Miyagi Do. Season 6 part 2 tho was one of the best part I’ve seen, I think I watched that part in a row and I was on my seat jumping almost haha. Part 3 ended in what I thought from all the spoilers from TikTok and stuff but still happy Miguel got the W. With a good show like Cobra Kai being over is sad so I’ve been watching the reactions from several YouTube reactors in order to watch it again, and I’ll probably watch it all again more times as well. Well all that said. 
Cobra Kai never dies ",1740773614.0,19,3,https://www.reddit.com/r/cobrakai/comments/1j0h3j3/cobra_kai_never_dies_what_an_ending/,immediate,general_reaction
