post_id,title,body,created_utc,score,num_comments,url,bucket,post_type
1is9ytv,Cobra Kai finale - my thoughts and review,"I originally planned to write this review after watching the first two episodes of the final season. The last part of Season 6 started off strong, but I held off until I had seen the whole thing. And I’m glad I did—because those final five episodes sum up Cobra Kai perfectly: a solid beginning, a gradual shift into chaos, and in the end, it was always about Johnny and Daniel.

Now I know this is Reddit, where people have strong opinions, but no one around me wants to talk about Cobra Kai, so I’m doing it here. 

Let’s have a real discussion because downvotes are for pussies.

**The Good**  
Like a lot of people who grew up in the ’90s, The Karate Kid was part of my childhood. When Cobra Kai first dropped on YouTube, I was hooked on the premise—flipping the perspective, making Johnny Lawrence the focus, and calling it Cobra Kai instead of The Karate Kid. It was a fresh take, and those first two seasons were genuinely great.

The show thrived on nostalgia, bringing back key characters and unpacking their old wounds. Sure, some things didn’t quite add up—like how losing to Daniel supposedly ruined Johnny’s entire life, or how he seemed completely unaware of the modern world—but it worked because it was fun, well-paced, and had heart.



**Where Cobra Kai Went Wrong**

By the end of Season 2, the cracks started showing. The show fell into the same trap as a lot of long-running series: refusing to let characters grow or let them go. Instead of bringing in fresh conflicts rooted in the past, it just kept recycling the same ones. Dojos changed hands. Rivalries flipped. But nothing really evolved. The stakes kept getting higher, but there were never real consequences.

  
The first two *Karate Kid* movies are *the* Karate Kid movies. Classic. The third one, though, was a full-on parody of what came before. It cranked up the villains to such an insane degree, making *The Karate Kid Part III* the weakest film in the trilogy. In *Cobra Kai*, instead of pulling from the magic of the first two films, they leaned into the mess of the third one and doubled down. Silver was already a cartoon villain in the ’80s, a millionaire obsessed with ruining a teenager’s life. Instead of replacing him, the show just cranked the absurdity up to 11. Supposedly rehabilitated and moved on? Nope. One mention of ""karate,"" and he’s right back to his old ways, burning through his fortune to settle a decades-old grudge.

**Strike Fast, Strike Hard, No Consequences**

In Cobra Kai’s version of reality, no matter how badly you screw up, the fallout never lasts. Whether you paralyze someone, get paralyzed yourself, destroy a house, or burn down a business, it’s all forgotten within two episodes and the police are never there. Meanwhile, Daniel, Johnny, Kreese and Silver spend six seasons fixated on events from 35 years ago.

**Karate or MMA?**

The fights in Cobra Kai started as grounded karate, but over time, they morphed into something closer to a live-action anime. What was once a mix of traditional karate with a bit of street brawling turned into high-flying, wire-fu chaos where the laws of physics—and basic human endurance—no longer applied.  
Miguel was paralyzed at the end of Season 2, only to make a near-miraculous recovery after a few pep talks and a Motley Crüe-fueled training montage. Characters got slammed through glass tables, thrown off balconies, and hurled into walls with enough force to cause permanent damage—yet they’d be back in the dojo the next day like nothing happened. By the 4th season, the show had abandoned even the pretense of realism, with kids and senior citizens alike taking part in full-contact, no-holds-barred battles as if they were in a Mortal Kombat tournament.

**The Stingray Effect**

The comedy started as a clever counterbalance to the melodrama, allowing the show to have fun without losing its emotional core. But as the seasons dragged on, the humor stopped working with the story and started working against it. Instead of adding self-awareness, it made serious moments feel like they belonged in a bad sitcom.

Take Stingray, for example. A mid-30s man training and hanging out with teenagers. He might be seen off as a quirky side character—a past-his-prime man-child trying to live out his teenage fantasy. By the time he became a key player in major plotlines, he felt less like a character and more like a recurring joke the writers refused to retire. And he wasn’t the only one.  
Chozen, who had a beautiful character arc closure in his early appearances in Cobra Kai, was a victim of the show’s need to keep pushing its wacky humor, turning his once-intense presence into something comically absurd.

Unlike them, Elisabeth Shue as Ali Mills and Tamlyn Tomita as Kumiko were fantastic, keeping their characters intact—probably because they had limited screen time, and the showrunners and scriptwriters didn’t have enough time to mess them up.

The slapstick gags, the one-liners, the wacky side characters—they piled up until Cobra Kai felt less like the scrappy underdog show it started as and more like an SNL parody of itself. The show wanted to have it both ways, balancing high-stakes karate battles with goofy comedy, but instead of blending the two, it just whiplashed between them. By the later seasons, it wasn’t just over-the-top—it was practically winking at the audience, daring us to take any of it seriously.

**Sekai Taikai**

Sekai Taikai, the so-called world tournament that was supposed to be the grand culmination of every rivalry, every redemption arc, every high-flying kick that came before it. Instead, it felt like the show cranked the dial past Cobra Kai and straight into Squid Game, minus the actual stakes. The rules made no sense. The matchups were absurd. It wasn’t a tournament—it was a montage of flashy fight scenes stitched together with just enough dialogue to remind us why the characters were still mad at each other.

By that point, realism had completely left the dojo. The show had gone from backyard karate brawls to a global competition where a bunch of high schoolers were somehow world-class fighters. The original appeal of Cobra Kai was watching underdogs train, struggle, and fight for something real. Now, we had kids pulling off wire-fu stunts in a tournament that felt more like an overproduced reality show. The stakes had never been lower, yet the show kept insisting it was bigger than ever.

**Production Value**

In terms of cinematography, music, and production design, Cobra Kai seemed to put most of its effort into the first two seasons. But once it found a new home on Netflix, instead of ramping up production, the show gradually took a step backward.

Even on a technical level, Cobra Kai never quite lived up to the hype. Filmed on high-end Sony Venice cameras and used Panavision Primo Lenses all the right tools to get that glorious cinematic look, somehow the image looked like a classic television, like a show you’d catch on a Wednesday night, not the high-profile Netflix series it was meant to be. Those flashbacks to the '80s and '60s? They looked like cheap plastic, oddly flat for something that likely had a budget between $2-3 million an episode—comparable to Breaking Bad's hefty production costs, no less.

The AI/CGI recreations of Mr Miyagi were horrifying, and I am sure I’ll have some nightmares about it later on (or some funny memes).

The music 

The Karate Kid films had an iconic, instantly recognizable sound—those classic '80s tracks that brought weight and urgency to the story. Cobra Kai, however, especially in its later seasons, sounded like someone plugged “epic karate fight music” into an AI generator. It’s hollow. It’s soulless. The soundtrack doesn’t build any tension—it drains it.

And the final tournament? A visual disaster. Gone was the energy of the epic open sport arena shot in broad daylight in the All Valley tournament.

Instead, we got a dimly lit studio bathed in neon lights, creating a sterile, lifeless atmosphere. The crowd? Barely there. The stakes? Barely felt. It didn’t have the intensity of a climactic event—it felt more like an off-Broadway play with half-empty seats—small and cheap.



**The Ending: Too Little, Too Late**

To be fair, the final episodes had some strong moments. They dialed back the insanity and focused on emotional payoffs for Johnny and Daniel. For the first time in a while, the show felt grounded again. But that only made things more frustrating—because it proved they could have done this all along. Instead, they wasted multiple seasons on nonsense, over-the-top villains, and recycled conflicts.

And then they rushed the ending. Tournament rules changed last minute. Dojos switched teams on a whim. Kreese and Silver got absurd send-offs, and nobody even acknowledged it. It was all just a sprint to the finish line.

**Final Thoughts**

For all its flaws, Cobra Kai still had heart. That heart came from The Karate Kid, and no matter how much Netflix stretched it, that core connection was always there. That’s why the last scene with Daniel and Johnny showed that it was about them all along, and that's why despite everything, I kept watching.

Personally, watching Cobra Kai has always been a mix of emotions. On one hand, it’s a series with so many issues, and I probably wouldn’t have watched it if it weren’t feeling attached to The Karate Kid. On the other hand, the creators knew exactly where to pull the nostalgia strings and stick them right in the heart. There was always a cameo that hit the mark, a quote, or a sample from the legendary Bill Conti soundtrack.

I actually communicated a bit with Jon Hurwitz on Twitter in earlier seasons. If I could ask him today one thing, it would be: What was the master plan from the very beginning, and when did it

Because while *Cobra Kai* started and ended in the right place, everything in between was a mess. It could’ve been tighter. It could’ve been smarter. But they got lost in the noise.  
  
Right after finishing Cobra Kai, I saw the trailer for The Karate Kid: Legends. And for the first time in a while, I felt excited again. The cinematography looked cinematic. The music had weight. Ralph Macchio’s performance felt more natural. It’s set three years after Cobra Kai, which gives it some distance. And I’m genuinely curious to see what they do with it.

Still, we got 65 episodes of *Cobra Kai* with Ralph Macchio and William Zabka—who, for the most part, took their roles seriously and carried the show on their backs.

Anyway, this review is probably too long for Reddit. But if you made it this far, let me know what you think. ",1739875708.0,91,68,https://www.reddit.com/r/cobrakai/comments/1is9ytv/cobra_kai_finale_my_thoughts_and_review/,immediate,general_reaction
1io367s,"Cobra Kai Never Dies, Farewell",,1739397937.0,711,24,https://i.redd.it/r24h5oh37sie1.jpeg,immediate,nostalgia_goodbye
1qxbd8s,Just Finished the Show and It’s a 10/10,"I grew up loving the Karate Kid movies but I never got around to watching Cobra Kai until recently. Wow this show was unbelievably good! My wife who has never seen the Karate Kid movies loved it. The character development was amazing, the characters had great depth, and the performances were fantastic. Some shows have mediocre or bad series finales, but this had one of the most satisfying endings I’ve ever seen. Cobra Kai has taken its spot as my all time favorite. ",1770363535.0,97,20,https://www.reddit.com/r/cobrakai/comments/1qxbd8s/just_finished_the_show_and_its_a_1010/,long_term,general_reaction
1jf82kw,Johnny will always be cobra kai and Daniel will always be miyagi do.,"I have been quite mixed on season 6 as a whole and didn't like a lot of the narrative directions taken this season, however I think where Johnny and Daniel end up is perfect and honors the core themes of karate kid, balance and strong roots.

One of the main themes of season 6 was the roots of Johnny and daniel. Why they are the way they are and how ultimately no matter how much they try they can't change where they came from and at most can just borrow some ideas from each other. Hayden even said this in an interview with strike first media and other content creators that johnny and daniel are always loyal to where they came from. We see this in season 5 where Daniel becomes more aggressive in his pursuit of silver. We also get snippets of Johnny from 4 channeling some of what miyagi do has taught him, like how he doesn't immediately strike back at daniel when he punches him in the face.

I have been foreseeing an ending like this for years now. Both Daniel and Johnnys karate coexisting and complimenting each other in a yin and yang way because like johnny said in order to be the best you can be you have to learn more than one discipline. Despite that though Johnny admits that due to his roots he can not teach him defence and self-control because his specialty is offense and aggression. A subtle change that in Johnnys character is where he says ""we do not train to be merciful here"". In season 1 he immediately followed that line with ""mercy is for the weak"" but this time he avoids saying that completely because he understands there is nothing wrong with showing mercy and that sometimes it is a requirement but ultimately it is not what cobra kai teaches. I  made another post on how this sort of connects to robby keene as a character because robby has trained in both cobra kai and miyagi do and he was the one that forced Daniel to look outside the box and consider the fact there are other styles out there.

The roadmap on how to get there was very messy and a lot of the writing decisions were utterly ridiculous imo. The entire sekai taikai was just laughable and imo was the worst written element in the entire series (the fact that same tournament continued was just laughable) and of course robby like his name got robbed. I think they easily could have had the same conclusion without any of the mishaps and filler this season and last season had.",1742419008.0,11,9,https://www.reddit.com/r/cobrakai/comments/1jf82kw/johnny_will_always_be_cobra_kai_and_daniel_will/,immediate,character_analysis
1ksumg9,OH MY GOD COBRA KAI IS AMAZING‼️‼️,"I just finished watching it. I am so satisfied with that ending. It did EVERYTHING.This was such a perfect ending.It gave closure to everything that was being built up. 
I AM SO GLAD I DECIDED TO WATCH THIS SHOW. NOW I WILL ALWAYS REMEMBER THE WAY OF THE FIST‼️‼️
STRIKE FIRST
STRIKE HARD
NO MERCY 🗣️🔥‼️🔥
(Also can we assume that kreese is gone now?)",1747930200.0,47,8,https://www.reddit.com/r/cobrakai/comments/1ksumg9/oh_my_god_cobra_kai_is_amazing/,immediate,general_reaction
1lxlmot,"Just finshed last part of season 6, MAN WHAT A FUCKING ENDING, IK AM 5 MONTHS LATE BUT FUCKKKKK","SORRY GUYS IK AM LATE, AM JUST SO HAPPY AND FULLFILLED TO WATCH THE FINAL PART, I TOTALLY FORGOT ABOUT IT BECAUSE OF MY EXAMS BUT FUCKING HELL, WHAT AN ENDING, THEY GAVE EVERY MC JUSTICE. LOVED IT SO MUCH. 

please dont say ""good morning bro""",1752276357.0,28,16,https://www.reddit.com/r/cobrakai/comments/1lxlmot/just_finshed_last_part_of_season_6_man_what_a/,immediate,general_reaction
1lwuzud,I’m gonna miss this show I finished watching all and I am gonna miss it so much,,1752199759.0,27,7,https://www.reddit.com/gallery/1lwuzud,immediate,nostalgia_goodbye
1ogb7ed,Why I Think Johnny Bringing Back His Version Of CK Is The Right Way To End The Show (Analysis),"I want to note that this is a redo of my Johnny Retaking CK Post that I made months ago. Here I wanted to go in depth added with rewrite ideas of how I wouldve executed Johnny's CK naturally.

""Before I proceed, I wanna note a few of my issues with Johnny Bringing Back CK &amp; it isnt what youd expect. I don't have a Problem with Johnny's CK returning but my issue is that it came at the expense of Robby being done a bit dirty &amp; robbed of a well-deserved W. Robby by far has the best character development of the teens added with the parrelels he shares to both Daniel &amp; Johnny alongside Miguel, &amp; his Underdog Journey. Another issue I have is that it was rushed without proper buildup. But I think the idea Concept of Johnny bringing back &amp; redeeming CK in the grand scheme of it all is a solid idea to end the show on as I dont think we should be expecting MD to win. I think the show is more than just bringing back &amp; redeeming CK but giving it its own distinct &amp; fundamental identity seperate from Kreese's &amp; Silver idea of what it should be. Johnny gave CK purpose &amp; the potential to be better than what it was originally intended for. But we do have to realize that The Brand itself is corrupted much like the students. The issue is not the brand, its Kreese &amp; Silver along with the philosophies they remade. CK is not the problem, Kreese &amp; Silver is. Under Johnny, CK has its own identity &amp; is not an Americanized Rip Off of Dohk Sa. I always felt like CK as a whole is a Bad-@$$ Name for a dojo with no soul or its own identity under Kreese &amp; Silver. Its funny how initially I was against Johnny retaking CK &amp; forging his own path through EF or MD but I realize something as While Kreese did create CK alongside Silver, he didnt make it his own thing. All Kreese did was repeat Kim Sun Yung's Dojo, Dohk Sa (The Venomous Snake). All it is is Dohk Sa 2.0. Cobra-Kai is a bad-@$$ name for a dojo without its own identity. So Johnny retaking it does thematically work in the grand scheme of it as Johnny, unlike Kreese made it its own thing &amp; changed it.

Kreese mightve founded CK but he never made it its own identity. Kreese &amp; Silver's CK is just an Americanized Dohk Sa 2.0. Though EF would be a cool course correct because CK as a brand is somewhat tainted a lot because of how CK was from S2-6 &amp; Kwon's death in particular. But Kwon was already a major product of Kim's Dojo &amp; Kreese played a small amount of influence to Kwon, which led to his death. But at the same time, every time Kreese &amp; Silver runs CK its all about honoring Kims ""Way Of The Fist"" &amp; sugar coats it as their legacy. My only issue again is that it came at some expense of Robby. But then again I believe CK is redeemable as a Dojo that is because under Kreese &amp; Silver, its just an Americanized Version of Kims Dojo with minor tweaks. So in conclusion, the Idea &amp; Concept Of Johnny retaking CK, changing it, &amp; redeeming it is thematically fitting, the issue was just how off the execution was. I enjoyed Part 3 &amp; S6 overall but I just wished aspects of it was executed better. Also, the main fundemental differences between Johnny's version of No Mercy &amp; Kreese's cynical &amp; vindictive No Mercy is that Johnny is more about ""Dont hold back all the time but at the same time know when you are going too far &amp; know when you are crossing a line Honestly, Johnny's CK is more like Batman &amp; Kim, Kreese, &amp; Silver's way is more The League Of Shadows. Johnny's No Mercy is more restrained &amp; his version of that word is ""You cant always hold back when push comes to shove or your life is on the line when defending yourself. But know your limits &amp; morals. Showing Mercy is not a weakness either as there is a difference between No Mercy &amp; No Honor""*.* Kreese's No Mercy is just being vicious &amp; psychopathic while crossing the line like S2 &amp; 3 Tory &amp; Hawk &amp; worse.....Kwon. Because its just a rinse &amp; repeat of Kims Dojo but Americanized with minor tweaks then &amp; there with lessons &amp; moves like The Silver-Bullet, etc.

For example, if anybody has read the comics or played The Injustice Game, Superman's legacy &amp; the S on his chance was severely tainted because Superman became a fascistic dictator. The S on his chest represented Hope but has been tainted severely &amp;when Supes went astray, Super Girl took over &amp; honored what this symbol stood for &amp; redeeming what being Superman or who he formerly was. Batman once stated that ""The symbol's meaning is up to the person who wears it. The same can be said with Johnny with his CK when it comes to him leading CK. Injustice Superman made people fear that Classic &amp; Iconic Symbol but Supergirl became that shining hope. Kreese &amp; Silver did what Injustice Superman did by making people fear The CK Brand. Johnny will do the opposite &amp; make it a better version of itself. Trust me, I initially thought CK was too far gone but then I realized that like the students, The Brand &amp; Name is just under the control of the wrong people. Kreese &amp; Silver may have founded CK but they never gave it its own soul apart from repeating Kim's way with minor tweaks &amp; a different coat of paint. Johnny's CK might be tainted a bit but not heavilly tarnished, &amp; in the eyes of the public, it will take a long while before Johnnys CK can fully gain the publics trust added with the clarification of what went behind the scenes (still wondering why nobody questioned Johnny being a EF Sensei in S4 &amp; just accept that CK is under new managment under the same Senseis who's student fought dirty in 1985). I mean there is so much possibilities with Johnny revealing what has transpired throughout the show behind the scenes to the media. But at the same time, CK has a long way. That I can agree on. But i do find it much more redeemable than The Iron &amp; Fighting Dragons &amp; even better than Demolition Martial Arts considering the Sensei is a fricken Loan Shark from KK Legends. I just dont think the CK Brand being redeemed should be equvilant to The Sith being redeemed as many people detested the idea of CK being redeemed under Johnny &amp; has used it as an example to twist bad faith."" 

Building off from my past rewrite post, I feel like S6 Part 3 having Miguel vs Yoon in Korea to fully earn the Captains Role for 6x14 wouldve been amazing as I had this in my headcanon since for the past few weeks. it takes place between 6x13 &amp; 14. Originally, I wanted Kreese to take Johnny, Daniel, Miguel, Sam, Robby, &amp; Tory to south Korea to get Kim Dae Uns blessing After all she is a Sensei of CK for a brief period of time. But I changed it to have Kim's Students come to America instead. I did plan to have the Final 52nd All-Valley involving them anyway Perhaps, Kreese contacts her. I wanted to also humanize Yoon in this very fight &amp; give his character more depth. Miguel wants to earn this role by beating Kim's ""Best Student"" honorably &amp; Miguel wins but what happens after is where I wouldve made this more impactful &amp; demonstrate how different Johnny's CK is from Kim's &amp; Kreese to audiences. Because of the of the more valid criticisms of Part 3 was Johnny retaking CK felt abit rush &amp; there wasnt time given to showcase how fundamentally different it would be from Kreese &amp; Silvers After Miguel beats Yoon for Captain, Yoon attempts to continue the fight but while attempting to do a kick similar to Kwon, he accidentally sprains it a bit. Despite Kim Dae Un's objections &amp; desire for Yoon to stop fighting, Yoon is adamant in continuing But in an emotional twist, Yoon breaks down &amp; unloads why hes doing this.........for Kwon. In the past, Yoon has mistreated Kwon &amp; in his mind this was his way to doing right by him &amp; make up for how he treated him Yoon was Kims Top Student &amp; probably was the closest to an older brother Kwon probably couldve had. This confession wouldve struck a core to Miguel who looks back from the sparring deck to Robby in crutches, bringing back alot of the guilt he feels for starting his rivalry with Robby &amp; how he simialrly to Yoon, treated him in S1-2, 5-6. Also the mention of Kwon's name, gives Miguel's flashback to seeing Kwon's lifeless body while transitioning to Miguel flashbacking to himself lying on the stair steps in 2x10 In a moment of compassion &amp; vulnerability, Miguel offers Yoon his hand &amp; takes him inside MD for him to heal up &amp; recover from his leg injury. They have a deep conversation &amp; Yoon questions why Miguel is acting compassionate despite what his Dojo has done to them &amp; Miguel admitts he has made mistakes himself &amp; Yoon is just like him. A Student at the top whos trying to be the best but in a moment of weakness made some bad decisions. This is a moment of Miguel admitting responsibility &amp; accountability for his past deeds &amp; inspires Yoon to not look deeply in the past &amp; also forgiving himself for how Kwon turned out. This is the moment where Miguel becomes of the epitome of Johnny's CK With Miguel &amp; Yoon having a moment of respect to one another &amp; as Miguel leaves the MD Building, Yoon just says one thing to him ""Give him all you got"" &amp; Kim Dae Un as touched by Miguel's compassion towards Yoon that she gives Johnny her final blessing to not only continue the tournament with Miguel as Captain, but continue to be an inspiration for the next generation through CK in a way her Grandfather was not. I would add a cool moment during the 6x14 training montage Lets just say Hawk invites another sparring partner for Miguel if you know what I mean lol (Diego). I mean it builds off the cool team up between Hawk, Demetri, &amp; The Furia Dojo during thr brawl so perhaps Miguel training against the Semi Finalist of the ST is another bonus for earning Captain.  Plus Furia are at the Valley so why not.



",1761451689.0,14,4,https://www.reddit.com/r/cobrakai/comments/1ogb7ed/why_i_think_johnny_bringing_back_his_version_of/,immediate,character_analysis
